{"application_id":"prime.programmatic-long-context","capabilities":[{"capability_id":"prime.programmatic-long-context","version":"1.0.0"}],"capability_packages":[{"package_id":"prime-programmatic-long-context-native","version":"1.0.0"}],"host_artifacts":[],"host_capabilities":["prime.ipython","prime.p2-oracle","prime.pi-extension","prime.private-trace","prime.session-backend"],"host_events":[],"host_policies":[],"protocol":"asterion.application-assembly/v1","runtime_id":"asterion.prime","version":"1.0.0"}
