{
  "protocol": "asterion.application-assembly/v1",
  "application_id": "dci.local-research",
  "version": "1.0.0",
  "runtime_id": "pi.reference",
  "capability_packages": [
    {"package_id": "dci", "version": "1.0.0"}
  ],
  "capabilities": [
    {"capability_id": "dci.evaluation", "version": "1.0.0"},
    {"capability_id": "dci.research", "version": "1.0.0"},
    {"capability_id": "policy.context-management", "version": "1.0.0"},
    {"capability_id": "policy.local-corpus", "version": "1.0.0"},
    {"capability_id": "protocol.observability", "version": "1.0.0"}
  ],
  "host_capabilities": [],
  "host_policies": [],
  "host_events": ["artifact.created", "run.completed", "run.started", "tool.result"],
  "host_artifacts": ["text/plain"]
}
