{"application_id":"prime.recursive-workflow","capabilities":[{"capability_id":"prime.recursive-workflow","version":"1.0.0"}],"capability_packages":[{"package_id":"prime-recursive-workflow-native","version":"1.0.0"}],"host_artifacts":[],"host_capabilities":["prime.child-runner","prime.p3-oracle","prime.pi-extension","prime.private-trace","prime.session-backend"],"host_events":[],"host_policies":[],"protocol":"asterion.application-assembly/v1","runtime_id":"asterion.prime","version":"1.0.0"}
