{"application_id":"contoso.research-compat","capabilities":[{"capability_id":"acme.research","version":"1.0.0"}],"capability_packages":[{"package_id":"acme.sample","version":"1.0.0"}],"host_artifacts":[],"host_capabilities":[],"host_events":[],"host_policies":[],"protocol":"asterion.application-assembly/v1","runtime_id":"contoso.inline","version":"1.0.0"}
