{
  "protocol": "asterion.application-assembly/v1",
  "application_id": "example.canonical-order",
  "version": "1.0.0",
  "runtime_id": "example.runtime",
  "capability_packages": [
    {"package_id": "a", "version": "1.0.0"},
    {"package_id": "a.b", "version": "1.0.0"}
  ],
  "capabilities": [
    {"capability_id": "a", "version": "1.0.0"},
    {"capability_id": "a.b", "version": "1.0.0"}
  ],
  "host_capabilities": [],
  "host_policies": [],
  "host_events": ["\uE000", "\uD800\uDC00"],
  "host_artifacts": []
}
