{
  "protocol": "asterion.application-assembly/v1",
  "application_id": "prime.arc-agi-3-gameplay",
  "version": "1.0.0",
  "runtime_id": "asterion.prime",
  "capability_packages": [
    {
      "package_id": "prime-arc-agi-3-gameplay",
      "version": "1.0.0"
    }
  ],
  "capabilities": [
    {
      "capability_id": "prime.arc-agi-3-gameplay",
      "version": "1.0.0"
    }
  ],
  "host_capabilities": [
    "prime.arc-broker",
    "prime.arc-run-evidence",
    "prime.ipython",
    "prime.launch"
  ],
  "host_policies": [],
  "host_events": [],
  "host_artifacts": []
}
