{
  "protocol": "asterion.application-assembly/v1",
  "application_id": "prime.continual-improvement",
  "version": "1.0.0",
  "runtime_id": "prime.agent",
  "capability_packages": [
    {"package_id": "prime-agent", "version": "1.0.0"}
  ],
  "capabilities": [
    {"capability_id": "prime.continual-improvement", "version": "1.0.0"}
  ],
  "host_capabilities": ["prime.continual-improvement-development"],
  "host_policies": [],
  "host_events": [],
  "host_artifacts": []
}
