{
  "protocol": "asterion.application-assembly/v1",
  "application_id": "dci.research-capability",
  "version": "1.0.0",
  "runtime_id": "claude-code.reference",
  "capability_packages": [
    {"package_id": "dci", "version": "1.0.0"}
  ],
  "capabilities": [
    {"capability_id": "dci.research", "version": "1.0.0"},
    {"capability_id": "policy.local-corpus", "version": "1.0.0"}
  ],
  "host_capabilities": ["corpus.local-root"],
  "host_policies": [],
  "host_events": [],
  "host_artifacts": []
}
