{"application_id":"prime.continual-improvement","capabilities":[{"capability_id":"policy.continual-loop","version":"1.0.0"}],"capability_packages":[{"package_id":"prime-continual-improvement-native","version":"1.0.0"}],"host_artifacts":[],"host_capabilities":["prime.candidate-store","prime.ipython","prime.p6-oracle","prime.pi-extension","prime.private-trace","prime.session-backend"],"host_events":[],"host_policies":[],"protocol":"asterion.application-assembly/v1","runtime_id":"asterion.prime","version":"1.0.0"}
