{"application_id":"prime.long-session-continuity","capabilities":[{"capability_id":"policy.long-session-loop","version":"1.0.0"}],"capability_packages":[{"package_id":"prime-long-session-continuity-native","version":"1.0.0"}],"host_artifacts":[],"host_capabilities":["prime.continuity-store","prime.p4-oracle","prime.pi-extension","prime.private-trace","prime.session-backend"],"host_events":[],"host_policies":[],"protocol":"asterion.application-assembly/v1","runtime_id":"asterion.prime","version":"1.0.0"}
