{"application_id":"prime.bounded-autonomy","capabilities":[{"capability_id":"policy.bounded-loop","version":"1.0.0"}],"capability_packages":[{"package_id":"prime-bounded-autonomy-native","version":"1.0.0"}],"host_artifacts":[],"host_capabilities":["prime.ipython","prime.p5-oracle","prime.pi-extension","prime.private-trace","prime.session-backend"],"host_events":[],"host_policies":[],"protocol":"asterion.application-assembly/v1","runtime_id":"asterion.prime","version":"1.0.0"}
