{
  "protocol": "asterion.application-assembly/v1",
  "application_id": "prime.ipython-coding",
  "version": "1.0.0",
  "runtime_id": "asterion.prime",
  "capability_packages": [
    {
      "package_id": "prime-ipython-coding-native",
      "version": "1.0.0"
    }
  ],
  "capabilities": [
    {
      "capability_id": "prime.ipython-coding",
      "version": "1.0.0"
    }
  ],
  "host_capabilities": [
    "prime.ipython",
    "prime.p1-oracle",
    "prime.pi-extension",
    "prime.private-trace",
    "prime.session-backend"
  ],
  "host_policies": [],
  "host_events": [],
  "host_artifacts": []
}
